{"access":{"class":"project_restricted","export_policy":"metadata_redacted","owner_project":"fixture_project","permitted_principals":["fixture_reviewer"]},"aliases":[{"type":"preferred_name","value":"Fixture W2 study knowledge snapshot"}],"blockers":[{"code":"no_calculation_authority","message":"The snapshot cannot authorize input generation or calculation.","source_refs":[]}],"calculation_ready":false,"contradictions":[],"created_at":"2026-07-15T00:00:00+00:00","created_by":"fixture_author","dependency_digest":"8ad9ccd390ac317d589979dbf04d1ec3a31c3468ba050a268b821f68d5d5b7e6","external_identifiers":[],"included_records":[{"access_class":"group_internal","payload_sha256":"65e800a2decdbb5fdaa3bec462fb83794e5bad1d01d04cf4bac8a39b049b5279","record_id":"fixture_boron_catalyst","record_type":"structure","review_status":"reviewed","revision_id":"fixture_boron_catalyst_r001"},{"access_class":"project_restricted","payload_sha256":"14064f71775d120047a06407734fe7636458332842cb0a2ce682e4291b836b04","record_id":"fixture_boron_catalyst_neutral_state","record_type":"structure","review_status":"reviewed","revision_id":"fixture_boron_catalyst_neutral_state_r001"},{"access_class":"project_restricted","payload_sha256":"179db894f334622f10478ca9c7078c744a236f41c67c242f9770b9b44b1c473c","record_id":"fixture_boron_catalyst_geometry","record_type":"structure","review_status":"reviewed_with_limits","revision_id":"fixture_boron_catalyst_geometry_r001"},{"access_class":"public","payload_sha256":"af656c1e93130638d22d848acdfd8d1a36aa4904dea382514a847721029f964d","record_id":"fixture_reported_method","record_type":"method","review_status":"reviewed","revision_id":"fixture_reported_method_r001"},{"access_class":"public","payload_sha256":"f2f0e6ab8605b1174026a008fb8291bd881d3254730b1f0381775bbe52d4fd15","record_id":"fixture_article","record_type":"source","review_status":"reviewed","revision_id":"fixture_article_r001"},{"access_class":"group_internal","payload_sha256":"c71c416370604086b8ae685166a154a40e9cf6af1ae1c89ee77d5ab98f2a9fed","record_id":"fixture_book","record_type":"source","review_status":"reviewed","revision_id":"fixture_book_r001"},{"access_class":"group_internal","payload_sha256":"6b931ef34b91559c03c4514c5d6aa167bac35bc0867fcbec167a1f2ec2c7ac6a","record_id":"fixture_structure_source_link","record_type":"link","review_status":"reviewed_with_limits","revision_id":"fixture_structure_source_link_r001"}],"no_submission_authorization":true,"parent_reaction_intake":{"path":"reaction-intake.json","payload_sha256":"dddddddddddddddddddddddddddddddddddddddddddddddddddddddddddddddd","schema":"gaussian-reaction-intake/1","sha256":"cccccccccccccccccccccccccccccccccccccccccccccccccccccccccccccccc","size_bytes":1024},"payload_sha256":"415891106b8f8511ed94e2abe3b755e3f7a35ff74ad7ead73b113dd1dafbf5c4","provenance":{"importer":null,"source_artifacts":[],"source_kind":"manual_review"},"queries":[{"executed_at":"2026-07-15T00:10:00+00:00","filters":["review_status=reviewed"],"query":"internal code FIX-B-01","query_id":"fixture_structure_query","registry":"structure"},{"executed_at":"2026-07-15T00:11:00+00:00","filters":["source_class=literature_reported"],"query":"synthetic boron fixture optimization frequency","query_id":"fixture_method_query","registry":"method"},{"executed_at":"2026-07-15T00:12:00+00:00","filters":["review_status=reviewed"],"query":"10.5555/auto.g16.fixture","query_id":"fixture_source_query","registry":"source"}],"record_id":"fixture_study_snapshot","redactions":["Project-restricted geometry content is not exported by this snapshot fixture."],"review":{"notes":["Synthetic snapshot retains an unresolved geometry limitation."],"reviewed_at":"2026-07-15T01:00:00+00:00","reviewer":"fixture_reviewer","status":"reviewed_with_limits"},"revision_id":"fixture_study_snapshot_r001","schema":"auto-g16-knowledge-snapshot/1","selection_decisions":[{"decision":"included","decision_id":"include_identity","rationale":"Reviewed fixture identity matches the internal code.","record_ref":{"payload_sha256":"65e800a2decdbb5fdaa3bec462fb83794e5bad1d01d04cf4bac8a39b049b5279","record_id":"fixture_boron_catalyst","record_type":"structure","revision_id":"fixture_boron_catalyst_r001"}},{"decision":"included","decision_id":"include_state","rationale":"Exact reviewed charge and multiplicity state is retained separately.","record_ref":{"payload_sha256":"14064f71775d120047a06407734fe7636458332842cb0a2ce682e4291b836b04","record_id":"fixture_boron_catalyst_neutral_state","record_type":"structure","revision_id":"fixture_boron_catalyst_neutral_state_r001"}},{"decision":"included","decision_id":"include_geometry","rationale":"Visualization-only geometry is retained with its limitation.","record_ref":{"payload_sha256":"179db894f334622f10478ca9c7078c744a236f41c67c242f9770b9b44b1c473c","record_id":"fixture_boron_catalyst_geometry","record_type":"structure","revision_id":"fixture_boron_catalyst_geometry_r001"}},{"decision":"included","decision_id":"include_method","rationale":"Reported protocol is retained only as a candidate evidence record.","record_ref":{"payload_sha256":"af656c1e93130638d22d848acdfd8d1a36aa4904dea382514a847721029f964d","record_id":"fixture_reported_method","record_type":"method","revision_id":"fixture_reported_method_r001"}},{"decision":"included","decision_id":"include_article","rationale":"Primary synthetic source carries the method anchor.","record_ref":{"payload_sha256":"f2f0e6ab8605b1174026a008fb8291bd881d3254730b1f0381775bbe52d4fd15","record_id":"fixture_article","record_type":"source","revision_id":"fixture_article_r001"}},{"decision":"included","decision_id":"include_book","rationale":"Book edition and page anchor exercise source rules.","record_ref":{"payload_sha256":"c71c416370604086b8ae685166a154a40e9cf6af1ae1c89ee77d5ab98f2a9fed","record_id":"fixture_book","record_type":"source","revision_id":"fixture_book_r001"}},{"decision":"included","decision_id":"include_link","rationale":"Reviewed link records the exact relationship and evidence anchor.","record_ref":{"payload_sha256":"6b931ef34b91559c03c4514c5d6aa167bac35bc0867fcbec167a1f2ec2c7ac6a","record_id":"fixture_structure_source_link","record_type":"link","revision_id":"fixture_structure_source_link_r001"}}],"study_id":"fixture_reaction_study","uncertainties":[{"code":"geometry_visualization_only","message":"The retained geometry is for visualization only.","source_refs":["fixture_boron_catalyst_geometry_r001"]}],"unresolved_gaps":["No benchmark validates transferability of the literature-reported method."]}
